No.,Brand,Product,Category,Standard Size,Volume (L),Weight (kg),Est. Price (PHP),Availability
303,Puree,PUREE Lacquer Thinner BTL,Solvent / hardener,350 mL bottle,0.35,,60,Active
304,Puree,PUREE Lacquer Thinner GAL,Solvent / hardener,4 L / gal,4,,580,Active
305,Puree,PUREE Paint Thinner BTL,Solvent / hardener,350 mL bottle,0.35,,60,Active
306,Puree,PUREE Paint Thinner GAL,Solvent / hardener,4 L / gal,4,,580,Active
307,Stripsoll,SPS STRIPSOLL Paint Stripper BTL,Paint / assorted,350 mL bottle,0.35,,70,Active
308,Stripsoll,SPS STRIPSOLL Paint Stripper GAL,Paint / assorted,4 L / gal,4,,800,Active
309,Sumo,Sumo PV Natural BTL,Paint / assorted,350 mL bottle,0.35,,70,Active
310,TAP Customs,Additional Color,Paint / assorted,piece / assorted,,,250,Active
311,TKO,TK-ATH TKO Acrylic Thinner 350ml BTL,Solvent / hardener,50 mL,0.05,,10,Active
312,TKO,TKO Gloss Latex,Latex paint,piece / assorted,,,250,Active
313,Unicoat,UC Metal Primer Red Oxide GAL,Enamel / lacquer / primer,4 L / gal,4,,900,Active
314,Universal,Universal Plus Flat White,Paint / assorted,piece / assorted,,,250,Active
315,Weber,1130-AE Weber AE Gold Toner GAL,Tint / automotive color,4 L / gal,4,,2200,Active
316,Weber,1780-AE Weber AE Violet GAL,Tint / automotive color,4 L / gal,4,,2200,Active
317,Weber,5050-AE Weber AE Metallic Fine GAL,Tint / automotive color,4 L / gal,4,,2800,Active
318,Weber,A-3360 Anzhal Wash Primer LT,Enamel / lacquer / primer,1 L,1,,420,Active
319,Weber,A-3882 Anzhal Spray Filler Gray LT,Spray paint,1 L,1,,220,Active
320,Weber,DR-1 Durax International Red GAL,Tint / automotive color,4 L / gal,4,,2200,Active
321,Weber,DR-2 Durax Lemon Yellow GAL,Tint / automotive color,4 L / gal,4,,2200,Active
322,Weber,DR-3 Durax Pthalo Blue GAL,Tint / automotive color,4 L / gal,4,,2200,Active
323,Weber,DR-4 Durax Pthalo Green GAL,Tint / automotive color,4 L / gal,4,,2200,Active
324,Weber,DR-5 Durax Black GAL,Tint / automotive color,4 L / gal,4,,2200,Active
325,Weber,DR-6 Durax White GAL,Tint / automotive color,4 L / gal,4,,2200,Active
326,Weber,DR-7 Durax Chocolate Brown GAL,Tint / automotive color,4 L / gal,4,,2200,Active
327,Weber,DR-8 Durax Caterpillar Yellow GAL,Tint / automotive color,4 L / gal,4,,2200,Active
328,Weber,DR-9 Durax Bright Orange GAL,Tint / automotive color,4 L / gal,4,,2200,Active
329,Weber,E-5000 WB EE White GAL,Tint / automotive color,4 L / gal,4,,2200,Active
330,Weber,E-5100 WB EE Black GAL,Tint / automotive color,4 L / gal,4,,2200,Active
331,Weber,E-5300 WB EE Lemon Yellow GAL,Tint / automotive color,4 L / gal,4,,2200,Active
332,Weber,E-5400 WB EE Moly Orange GAL,Tint / automotive color,4 L / gal,4,,2200,Active
333,Weber,E-5500 WB EE Pthalo Blue GAL,Tint / automotive color,4 L / gal,4,,2200,Active
334,Weber,E-5600 WB EE Phthalo Green GAL,Tint / automotive color,4 L / gal,4,,2200,Active
335,Weber,E-5700 WB EE Bright Red GAL,Tint / automotive color,4 L / gal,4,,2200,Active
336,Weber,E-6000 WB EP White GAL,Tint / automotive color,4 L / gal,4,,2200,Active
337,Weber,E-6100 WB EP Black GAL,Tint / automotive color,4 L / gal,4,,2200,Active
338,Weber,E-6200 WB EP Gray GAL,Tint / automotive color,4 L / gal,4,,2200,Active
339,Weber,E-6300 WB EP Zinc Rich Yellow GAL,Tint / automotive color,4 L / gal,4,,2200,Active
340,Weber,E-6700 WB EP Red Oxide GAL,Tint / automotive color,4 L / gal,4,,2200,Active
341,Weber,FPU-500 Flat Black LT,Paint / assorted,1 L,1,,200,Active
342,Weber,Hi-Sparkle Mica White GAL,Tint / automotive color,4 L / gal,4,,2800,Active
343,Weber,K-111 K92 Clearcoat Matte,Enamel / lacquer / primer,piece / assorted,,,250,Active
344,Weber,K-222 Top Coat Rapid Cure K92 LT,Enamel / lacquer / primer,1 L,1,,450,Active
345,Weber,K-650 K92 Thinner GAL,Solvent / hardener,4 L / gal,4,,950,Active
346,Weber,K-650 K92 Thinner LT,Solvent / hardener,1 L,1,,260,Active
347,Weber,MICA PEARL SERIES WPU-903 Chromatone Mica Yellow 4L,Tint / automotive color,4 L,4,,2800,Active
348,Weber,MICA PEARL SERIES WPU-905 Chromatone Mica Blue 4L,Tint / automotive color,4 L,4,,2800,Active
349,Weber,MICA PEARL SERIES WPU-906 Chromatone Mica Green 4L,Tint / automotive color,4 L,4,,2800,Active
350,Weber,MICA PEARL SERIES WPU-907 Chromatone Mica Red 4L,Tint / automotive color,4 L,4,,2800,Active
351,Weber,MICA PEARL SERIES WPU-908 Chromatone Mica Violet 4L,Tint / automotive color,4 L,4,,2800,Active
352,Weber,MICA PEARL SERIES WPU-933 Hi-Sparkle Mica Copper 4L,Tint / automotive color,4 L,4,,2800,Active
353,Weber,MICA PEARL SERIES WPU-934 Hi-Sparkle Mica Bronze 4L,Tint / automotive color,4 L,4,,2800,Active
354,Weber,MICA PEARL SERIES WPU-935 Hi-Sparkle Mica Russet 4L,Tint / automotive color,4 L,4,,2800,Active
355,Weber,MICA PEARL SERIES WPU-951 Extra Fine White Pearl 4L,Tint / automotive color,4 L,4,,2800,Active
356,Weber,MICA PEARL SERIES WPU-952 Fine White Pearl 4L,Tint / automotive color,4 L,4,,2800,Active
357,Weber,Primo Coat Pthalo Blue GAL,Paint / assorted,4 L / gal,4,,800,Active
358,Weber,R-25 Acrylic Thinner BTL,Solvent / hardener,350 mL bottle,0.35,,90,Active
359,Weber,R-25 Acrylic Thinner GAL,Solvent / hardener,4 L / gal,4,,950,Active
360,Weber,R-25 Acrylic Thinner LT,Solvent / hardener,1 L,1,,260,Active
361,Weber,SP-1200 Weber Spray Hi-Temp Black,Spray paint,400 mL,0.4,,220,Active
362,Weber,SP-1300 Weber Spray Hi-Temp Silver,Spray paint,400 mL,0.4,,220,Active
363,Weber,SP-132 Weber Spray Metallic Brown,Spray paint,400 mL,0.4,,220,Active
364,Weber,SP-145 Weber Spray Primer Gray,Spray paint,400 mL,0.4,,220,Active
365,Weber,SP-190 Weber Spray Clear,Spray paint,400 mL,0.4,,220,Active
366,Weber,SP-36 Weber Spray Bright Silver,Spray paint,400 mL,0.4,,220,Active
367,Weber,SP-39 Weber Spray Black,Spray paint,400 mL,0.4,,220,Active
368,Weber,SP-4 Weber Spray Matte Black,Spray paint,400 mL,0.4,,220,Active
369,Weber,SP-40 Weber Spray White,Spray paint,400 mL,0.4,,220,Active
370,Weber,TINTING COLOR WPU-610 Transparent Green 4L,Tint / automotive color,4 L,4,,2200,Active
371,Weber,TINTING COLOR WPU-700 International Red 4L,Tint / automotive color,4 L,4,,2200,Active
372,Weber,TINTING COLOR WPU-710 Red Gold 4L,Tint / automotive color,4 L,4,,2200,Active
373,Weber,TINTING COLOR WPU-718 Deep Red 4L,Tint / automotive color,4 L,4,,2200,Active
374,Weber,TINTING COLOR WPU-728 Organic Red Toner 4L,Tint / automotive color,4 L,4,,2200,Active
375,Weber,TINTING COLOR WPU-730 Ferrari Red 4L,Tint / automotive color,4 L,4,,2200,Active
376,Weber,TINTING COLOR WPU-740 Bon Maroon 4L,Tint / automotive color,4 L,4,,2200,Active
377,Weber,TINTING COLOR WPU-760 Magenta 4L,Tint / automotive color,4 L,4,,2200,Active
378,Weber,TINTING COLOR WPU-780 Cinquasia Violet 4L,Tint / automotive color,4 L,4,,2200,Active
379,Weber,UP-100 Spray Filler Gray LT,Spray paint,1 L,1,,220,Active
380,Weber,UP-200 Spray Filler White LT,Spray paint,1 L,1,,220,Active
381,Weber,UP-400 Spray Filler Anti-corrosion LT,Spray paint,1 L,1,,220,Active
382,Weber,UPS-200 Ultra Primer Surfacer Light Gray LT,Enamel / lacquer / primer,1 L,1,,420,Active
383,Weber,UT-20 Urethane Thinner BTL,Solvent / hardener,350 mL bottle,0.35,,90,Active
384,Weber,UT-20 Urethane Thinner GAL,Solvent / hardener,4 L / gal,4,,950,Active
385,Weber,UT-20 Urethane Thinner LT,Solvent / hardener,1 L,1,,260,Active
386,Weber,WA-10 Extra Topcoat Catalyst 1/4L,Solvent / hardener,0.25 L,0.25,,70,Active
387,Weber,WPU-090 UT Mixing Clear,Tint / automotive color,piece / assorted,,,250,Active
388,Weber,WPU-100 Weber Bright White GAL,Tint / automotive color,4 L / gal,4,,2200,Active
389,Weber,WPU-200 Weber Jet Black GAL,Tint / automotive color,4 L / gal,4,,2200,Active
390,Weber,WPU-210 Weber Super Jet Black GAL,Tint / automotive color,4 L / gal,4,,2200,Active
391,Weber,WPU-300 Weber Organic Lemon Yellow GAL,Tint / automotive color,4 L / gal,4,,2200,Active
392,Weber,WPU-310 Weber Ferrite Yellow GAL,Tint / automotive color,4 L / gal,4,,2200,Active
393,Weber,WPU-315 Weber Organic Cool Yellow GAL,Tint / automotive color,4 L / gal,4,,2200,Active
394,Weber,WPU-320 Weber Yellow Toner (Yellow Gold) GAL,Tint / automotive color,4 L / gal,4,,2200,Active
395,Weber,WPU-330 Weber Verdant Yellow GAL,Tint / automotive color,4 L / gal,4,,2200,Active
396,Weber,WPU-430 Weber Organic Orange GAL,Tint / automotive color,4 L / gal,4,,2200,Active
397,Weber,WPU-500 Weber Cyanine Blue GAL,Tint / automotive color,4 L / gal,4,,2200,Active
398,Weber,WPU-510 Weber Transparent Blue GAL,Tint / automotive color,4 L / gal,4,,2200,Active
399,Weber,WPU-520 Weber Verdant Blue GAL,Tint / automotive color,4 L / gal,4,,2200,Active
400,Weber,WPU-525 Weber Bright Blue GAL,Tint / automotive color,4 L / gal,4,,2200,Active
401,Weber,WPU-530 Weber Blue GAL,Tint / automotive color,4 L / gal,4,,2200,Active
402,Weber,WPU-600 Weber Cyanine Green GAL,Tint / automotive color,4 L / gal,4,,2200,Active
403,Weber,WPU-750 UT Permanent Maroon GAL,Tint / automotive color,4 L / gal,4,,2200,Active
404,Weber,WPU-800 Metallic Fine Irid GAL,Tint / automotive color,4 L / gal,4,,2800,Active
405,Weber,WPU-8051 Crystal Silver Fine GAL,Tint / automotive color,4 L / gal,4,,2200,Active
406,Weber,WPU-8053 Crystal Silver Coarse GAL,Tint / automotive color,4 L / gal,4,,2200,Active
407,Weber,WPU-810 Metallic Coarse Irid GAL,Tint / automotive color,4 L / gal,4,,2800,Active
408,Weber,WPU-820 Metallic Hi Sparkle Irid GAL,Tint / automotive color,4 L / gal,4,,2800,Active
409,Weber,WPU-820 Metallic Hi-Sparkle Irid GAL,Tint / automotive color,4 L / gal,4,,2800,Active
410,Weber,WPU-901 Mica Pearl Luster White GAL,Tint / automotive color,4 L / gal,4,,2800,Active
411,Weber,WPU-932 Hi-Sparkle Mica Gold GAL,Tint / automotive color,4 L / gal,4,,2800,Active
412,Weber,WU-001 2K Clearcoat LT,Enamel / lacquer / primer,1 L,1,,450,Active
413,Weber,WU-002 Mirror Finish 2K Clearcoat LT,Enamel / lacquer / primer,1 L,1,,450,Active
414,Yakoo,YAKOO 328 Beige Putty w/ Hardener GAL,Solvent / hardener,4 L / gal,4,,650,Active
415,Yakoo,YAKOO 328 Beige Putty w/ Hardener LT,Solvent / hardener,1 L,1,,180,Active
416,Yakoo,YAKOO 380 Putty w/ Hardener GAL,Solvent / hardener,4 L / gal,4,,650,Active
417,Yakoo,YAKOO 380 Putty w/ Hardener LT,Solvent / hardener,1 L,1,,180,Active
418,Yester,Yester SP #100 (copy),Accessory / tool,piece / assorted,,,15,Active
419,N/A,1/2 CAN,Paint / assorted,0.5 L can,0.5,,100,Active
420,N/A,1/4 CAN,Paint / assorted,0.25 L can,0.25,,50,Active
421,N/A,1L CAN,Paint / assorted,1 L can,1,,200,Active
422,N/A,GLASURIT GH-B Hardener Only Big TUBE,Solvent / hardener,big tube,0.2,,40,Active
423,N/A,NP Newspaper 1/2 KG,Accessory / tool,0.5 kg,,0.5,30,Active
424,N/A,NP Newspaper 1KG,Accessory / tool,1 kg,,1,50,Active
425,N/A,PLC Fiber Optic Spliter,Accessory / tool,piece / assorted,,,100,Active
426,N/A,RGC Rug Colored 1 KG,Accessory / tool,1 kg,,1,70,Active
427,N/A,RGC Rug Colored 1/2 KG,Accessory / tool,0.5 kg,,0.5,40,Active
428,N/A,RGW Rug White 1 KG,Accessory / tool,1 kg,,1,70,Active
429,N/A,RGW Rug White 1/2 KG,Accessory / tool,0.5 kg,,0.5,40,Active
